{
  "version": 1,
  "taskId": "CHANGE_ME_TASK_ID",
  "repo": "m-shogo/CHANGE_ME_REPO",
  "branch": "CHANGE_ME_BRANCH",
  "path": "CHANGE_ME_GIT_PATH/image.png",
  "sourceFile": "CHANGE_ME_IMAGE_FILE.png",
  "sha256": "AUTO_CALCULATE_FROM_IMAGE_BYTES",
  "overwrite": false,
  "purpose": "CHANGE_ME_PURPOSE",
  "createdBy": "chatgpt-image"
}
